Nhân_viên,Tên_gọi,Chức_vụ,Bộ_phận,Ngày_sinh,Ngày_vào_công_ty,Mô_tả_công_việc,Kỹ_năng,Mục_tiêu
LÊ THỊ NGỌC,t_ngoc,Trưởng bộ phận,Tổng vụ (GA),03/03/1987,9/2015,"Là Trưởng Bộ phận chuyên trách công việc liên quan đến nhân sự nên tôi ý thức và luôn học hỏi để ngày càng có nhiều hơn các kỹ năng chuyên môn, giao tiếp, quản lý nhân sự, giải quyết vấn đề.  Trước khi vào Brycen tôi chưa từng nghĩ rằng công việc của bộ phận Tổng vụ có tầm quan trọng đến như vậy. Từ khi vào Brycen tôi đã được học hỏi và làm việc với các anh chị em và dần dần đã trưởng thành hơn rất nhiều. Tôi luôn mong muốn thực hiện đầy đủ, đúng quyền hạn và trách nhiệm của mình để mang lại những lợi ích cần thiết cho toàn bộ nhân sự Công ty, sắp xếp xây dựng môi trường Công ty tốt hơn và góp phần xây dựng Công ty ngày càng lớn mạnh","chuyên môn, giao tiếp, quản lý nhân sự, giải quyết vấn đề","Mang lại lợi ích cho nhân sự, xây dựng môi trường công ty tốt hơn, góp phần xây dựng công ty lớn mạnh"
TRẦN PHÁP,t_phap,Phó Bộ phận,DEV (DEV-BAS Manager),10/06/1984,09/12/2009,"Tôi đã đồng hành cùng Brycen Việt Nam trong một chặng đường dài, hiện nay vẫn đang bước tiếp trên con đường đó. Đam mê, nỗ lực trong công việc là những yếu tố rất quan trọng để có thể đạt được thành công. Tôi mong muốn các thành viên trong công ty luôn giữ vững tinh thần và bầu nhiệt huyết, từ đó công ty mới có những bước tiến vững vàng.","Đam mê, nỗ lực","Thành công cá nhân và sự phát triển vững vàng của công ty"
TRẦN HỮU TRUNG,h_trung,Phó Bộ phận,DEV (DEV-EMS Manager),13/05/1983,01/10/2010,"Trong tập thể, nếu biết cách tạo động lực và gắn kết mỗi cá nhân lại với nhau sẽ phát huy được sức mạnh của tập thể. Từ đó nâng cao giá trị cho tập thể cũng như mỗi cá nhân.","Tạo động lực, gắn kết","Nâng cao giá trị tập thể và cá nhân"
TRẦN HỒNG THIÊN THƯ,t_thu,Trưởng nhóm,DEV-BAS (Leader),18/04/1981,20/09/2013,"“IF You Think You Can, You Can” Trong công việc đừng bao giờ bắt đầu với suy nghĩ mình không thể. Hãy đặt ra mục tiêu và cố gắng, nổ lực thì chắc chắn sẽ gặt hái được kết quả tốt đẹp.","Đặt mục tiêu, cố gắng, nỗ lực","Gặt hái kết quả tốt đẹp"
NGUYỄN NGỌC THI,n_thi,Trưởng bộ phận,BLJ,02/12/1982,01/04/2008,"Trong công việc để hoàn thành tốt, luôn rất cần có sự hợp tác, cộng tác của nhiều người với những khả năng và vai trò khác nhau cùng chung sức lại. Cá nhân tôi rất mong muốn có thể kết hợp được tất cả mọi người với những khả năng khác nhau để chung sức đoàn kết xây dựng các bộ phận và Công ty ngày càng phát triển. Hơn nữa cũng mong muốn toàn bộ nhân viên trong công ty, luôn giữ vững tinh thần và bầu nhiệt huyết, từ đó nâng cao hoàn thiện khả năng bản thân, cùng chung tay đưa công ty Brycen Việt Nam tiến những bước tiến vững chắc trên con đường phát triển.","Hợp tác, cộng tác","Phát triển các bộ phận và công ty, nâng cao khả năng bản thân"
CHẾ TÁM NĂM,t_nam,Trưởng nhóm,BLJ,17/06/1985,11/2011,"Tôi tham gia vào công việc ở bộ phận BLJ từ cuối năm 2012, cũng như bao Newbie khác khi bắt đầu một công việc mới luôn gặp không ít những bỡ ngỡ và khó khăn, đặc biệt là vấn đề bất đồng ngôn ngữ (tiếng Nhật). Tuy nhiên nhờ vào sự nỗ lực của bản thân cũng như sự hỗ trợ giúp đỡ của các đồng nghiệp, tôi đã dần hoàn thiện mình để đáp ứng nhu cầu của công việc. Hiện tại công việc của bộ phận luôn đòi hỏi sự nhanh chóng và chính xác cao. Với tôi ngoài việc luôn học hỏi để nâng cao kỹ năng, kiến thức, thì tính cẩn thận chu đáo trong công việc luôn được đặt lên hàng đầu.","Nỗ lực, học hỏi, cẩn thận, chu đáo","Hoàn thiện bản thân, đáp ứng nhu cầu công việc"
TÔN NỮ THANH HIỀN,t_hien,Trưởng nhóm,DTP,11/06/1990,18/02/2013,"Tôi đang tham gia công việc chỉnh sửa bản đồ và gia công ảnh trong nhóm DTP. Ngoài công việc giao dịch với khách hàng, nhận yêu cầu, triển khai phân chia, giải thích công việc cho nhóm, tôi cũng trực tiếp tham gia chỉnh sửa và kiểm tra bản đồ, ảnh. Công việc tôi đòi hỏi phải biết sử dụng các phần mềm như Illustrator và Photoshop, quan trọng là phải hiểu tiếng Nhật. Gần đây chúng tôi được giao thêm công việc nhập liệu Visio, sử dụng phần mềm Visio để vẽ flowchart và nhập nội dung tiếng Nhật của các hệ thống xử lí như điện, nước, rác thải... theo yêu cầu từ khách hàng. Để phát triển tốt hơn công việc của bản thân và của cả nhóm, tôi không ngừng học tập rèn luyện các kĩ thuật chuyên môn, kỹ năng tiếng Nhật. Nếu kỹ năng ngôn ngữ càng tốt, giao tiếp càng trôi chảy và càng hiểu được yêu cầu của khách hàng thì sẽ tiếp nhận được thêm nhiều công việc khác nữa. Theo đó, tôi sẽ được nâng cao năng lực của bản thân, ngày càng đóng góp được nhiều cho sự phát triển của công ty.","Illustrator, Photoshop, tiếng Nhật, Visio","Phát triển công việc bản thân và nhóm, đóng góp cho sự phát triển của công ty"